sentence	positive	neutral	negative
'As I came near them, the chief of the merchants rose up and drew his sword, and asked me my business. 	0.27574214	0.52749896	0.19675897
'I answered that I was a Prince in my own land, and that I had escaped from the Tartars, who had sought to make me their slave. 	0.27574214	0.52749896	0.19675897
The chief smiled, and showed me five heads fixed upon long reeds of bamboo. 	0.56479144	0.3808266	0.05438204
'Then he asked me who was the prophet of God, and I answered him Mohammed. 	0.27574214	0.52749896	0.19675897
'When he heard the name of the false prophet, he bowed and took me by the hand, and placed me by his side. 	0.27574214	0.52749896	0.19675897
A negro brought me some mare’s milk in a wooden dish, and a piece of lamb’s flesh roasted. 	0.27574214	0.52749896	0.19675897
'At daybreak we started on our journey. 	0.27574214	0.52749896	0.19675897
I rode on a red–haired camel by the side of the chief, and a runner ran before us carrying a spear. 	0.27574214	0.52749896	0.19675897
The men of war were on either hand, and the mules followed with the merchandise. 	0.27574214	0.52749896	0.19675897
There were forty camels in the caravan, and the mules were twice forty in number. 	0.27574214	0.52749896	0.19675897
'We went from the country of the Tartars into the country of those who curse the Moon. 	0.11110061	0.43357334	0.45532602
We saw the Gryphons guarding their gold on the white rocks, and the scaled Dragons sleeping in their caves. 	0.27574214	0.52749896	0.19675897
As we passed over the mountains we held our breath lest the snows might fall on us, and each man tied a veil of gauze before his eyes. 	0.27574214	0.52749896	0.19675897
As we passed through the valleys the Pygmies shot arrows at us from the hollows of the trees, and at night–time we heard the wild men beating on their drums. 	0.27574214	0.52749896	0.19675897
When we came to the Tower of Apes we set fruits before them, and they did not harm us. 	0.56479144	0.3808266	0.05438204
When we came to the Tower of Serpents we gave them warm milk in howls of brass, and they let us go by. 	0.27574214	0.52749896	0.19675897
Three times in our journey we came to the banks of the Oxus. 	0.27574214	0.52749896	0.19675897
We crossed it on rafts of wood with great bladders of blown hide. 	0.27574214	0.52749896	0.19675897
The river–horses raged against us and sought to slay us. 	0.11110061	0.43357334	0.45532602
When the camels saw them they trembled. 	0.11110061	0.43357334	0.45532602
'The kings of each city levied tolls on us, but would not suffer us to enter their gates. 	0.11110061	0.43357334	0.45532602
They threw us bread over the walls, little maize–cakes baked in honey and cakes of fine flour filled with dates. 	0.27574214	0.52749896	0.19675897
For every hundred baskets we gave them a bead of amber. 	0.27574214	0.52749896	0.19675897
'When the dwellers in the villages saw us coming, they poisoned the wells and fled to the hill–summits. 	0.11110061	0.43357334	0.45532602
We fought with the Magadae who are born old, and grow younger and younger every year, and die when they are little children; and with the Laktroi who say that they are the sons of tigers, and paint themselves yellow and black; and with the Aurantes who bury their dead on the tops of trees, and themselves live in dark caverns lest the Sun, who is their god, should slay them; and with the Krimnians who worship a crocodile, and give it earrings of green glass, and feed it with butter and fresh fowls; and with the Agazonbae, who are dog–faced; and with the Sibans, who have horses' feet, and run more swiftly than horses. 	0.27574214	0.52749896	0.19675897
A third of our company died in battle, and a third died of want. 	0.11110061	0.43357334	0.45532602
The rest murmured against me, and said that I had brought them an evil fortune. 	0.11110061	0.43357334	0.45532602
I took a horned adder from beneath a stone and let it sting me. 	0.11110061	0.43357334	0.45532602
When they saw that I did not sicken they grew afraid. 	0.11110061	0.43357334	0.45532602
'In the fourth month we reached the city of Illel. 	0.27574214	0.52749896	0.19675897
It was night–time when we came to the grove that is outside the walls, and the air was sultry, for the Moon was travelling in Scorpion. 	0.27574214	0.52749896	0.19675897
We took the ripe pomegranates from the trees, and brake them, and drank their sweet juices. Then we lay down on our carpets, and waited for the dawn. 	0.27574214	0.52749896	0.19675897
'And at dawn we rose and knocked at the gate of the city. 	0.27574214	0.52749896	0.19675897
It was wrought out of red bronze, and carved with sea–dragons and dragons that have wings. 	0.27574214	0.52749896	0.19675897
The guards looked down from the battlements and asked us our business. 	0.27574214	0.52749896	0.19675897
The interpreter of the caravan answered that we had come from the island of Syria with much merchandise. 	0.27574214	0.52749896	0.19675897
They took hostages, and told us that they would open the gate to us at noon, and bade us tarry till then. 	0.11110061	0.43357334	0.45532602
'When it was noon they opened the gate, and as we entered in the people came crowding out of the houses to look at us, and a crier went round the city crying through a shell. 	0.27574214	0.52749896	0.19675897
We stood in the market–place, and the negroes uncorded the bales of figured cloths and opened the carved chests of sycamore. 	0.27574214	0.52749896	0.19675897
And when they had ended their task, the merchants set forth their strange wares, the waxed linen from Egypt and the painted linen from the country of the Ethiops, the purple sponges from Tyre and the blue hangings from Sidon, the cups of cold amber and the fine vessels of glass and the curious vessels of burnt clay. 	0.11110061	0.43357334	0.45532602
From the roof of a house a company of women watched us. 	0.27574214	0.52749896	0.19675897
One of them wore a mask of gilded leather. 	0.27574214	0.52749896	0.19675897
'And on the first day the priests came and bartered with us, and on the second day came the nobles, and on the third day came the craftsmen and the slaves. 	0.56479144	0.3808266	0.05438204
And this is their custom with all merchants as long as they tarry in the city. 	0.27574214	0.52749896	0.19675897
'And we tarried for a moon, and when the moon was waning, I wearied and wandered away through the streets of the city and came to the garden of its god. 	0.56479144	0.3808266	0.05438204
The priests in their yellow robes moved silently through the green trees, and on a pavement of black marble stood the rose–red house in which the god had his dwelling. 	0.27574214	0.52749896	0.19675897
Its doors were of powdered lacquer, and bulls and peacocks were wrought on them in raised and polished gold. 	0.27574214	0.52749896	0.19675897
The tilted roof was of sea–green porcelain, and the jutting eaves were festooned with little bells. 	0.27574214	0.52749896	0.19675897
When the white doves flew past, they struck the bells with their wings and made them tinkle. 	0.27574214	0.52749896	0.19675897
'In front of the temple was a pool of clear water paved with veined onyx. 	0.27574214	0.52749896	0.19675897
I lay down beside it, and with my pale fingers I touched the broad leaves. 	0.27574214	0.52749896	0.19675897
One of the priests came towards me and stood behind me. He had sandals on his feet, one of soft serpent–skin and the other of birds' plumage. 	0.27574214	0.52749896	0.19675897
On his head was a mitre of black felt decorated with silver crescents. 	0.27574214	0.52749896	0.19675897
Seven yellows were woven into his robe, and his frizzed hair was stained with antimony. 	0.11110061	0.43357334	0.45532602
'After a little while he spake to me, and asked me my desire. 	0.27574214	0.52749896	0.19675897
'I told him that my desire was to see the god. 	0.27574214	0.52749896	0.19675897
'"The god is hunting," said the priest, looking strangely at me with his small slanting eyes. 	0.27574214	0.52749896	0.19675897
'"Tell me in what forest, and I will ride with him," I answered. 	0.27574214	0.52749896	0.19675897
He combed out the soft fringes of his tunic with his long pointed nails.  	0.27574214	0.52749896	0.19675897
“The god is asleep," he murmured. 	0.27574214	0.52749896	0.19675897
Tell me on what couch, and I will watch by him, I answered. 	0.27574214	0.52749896	0.19675897
The god is at the feast, he cried. 	0.27574214	0.52749896	0.19675897
If the wine be sweet I will drink it with him, and if it be bitter I will drink it with him also, was my answer. 	0.27574214	0.52749896	0.19675897
'He bowed his head in wonder, and, taking me by the hand, he raised me up, and led me into the temple. 	0.56479144	0.3808266	0.05438204
'And in the first chamber I saw an idol seated on a throne of jasper bordered with great orient pearls.  	0.27574214	0.52749896	0.19675897
It was carved out of ebony, and in stature was of the stature of a man. 	0.27574214	0.52749896	0.19675897
On its forehead was a ruby, and thick oil dripped from its hair on to its thighs. 	0.27574214	0.52749896	0.19675897
Its feet were red with the blood of a newly–slain kid, and its loins girt with a copper belt that was studded with seven beryls. 	0.27574214	0.52749896	0.19675897
'And I said to the priest, "Is this the god?" And he answered me, "This is the god." 	0.27574214	0.52749896	0.19675897
'"Show me the god," I cried, "or I will surely slay thee." 	0.56479144	0.3808266	0.05438204
And I touched his hand, and it became withered. 	0.11110061	0.43357334	0.45532602
'And the priest besought me, saying, "Let my lord heal his servant, and I will show him the god." 	0.56479144	0.3808266	0.05438204
'So I breathed with my breath upon his hand, and it became whole again, and he trembled and led me into the second chamber, and I saw an idol standing on a lotus of jade hung with great emeralds. 	0.56479144	0.3808266	0.05438204
It was carved out of ivory, and in stature was twice the stature of a man. 	0.27574214	0.52749896	0.19675897
On its forehead was a chrysolite, and its breasts were smeared with myrrh and cinnamon. 	0.27574214	0.52749896	0.19675897
In one hand it held a crooked sceptre of jade, and in the other a round crystal. 	0.27574214	0.52749896	0.19675897
It ware buskins of brass, and its thick neck was circled with a circle of selenites. 	0.27574214	0.52749896	0.19675897
'And I said to the priest, "Is this the god?" 	0.27574214	0.52749896	0.19675897
'And he answered me, "This is the god." 	0.56479144	0.3808266	0.05438204
'"Show me the god," I cried, "or I will surely slay thee." 	0.56479144	0.3808266	0.05438204
And I touched his eyes, and they became blind. 	0.11110061	0.43357334	0.45532602
'And the priest besought me, saying, "Let my lord heal his servant, and I will show him the god." 	0.56479144	0.3808266	0.05438204
'So I breathed with my breath upon his eyes, and the sight came back to them, and he trembled again, and led me into the third chamber, and lo! there was no idol in it, nor image of any kind, but only a mirror of round metal set on an altar of stone. 	0.27574214	0.52749896	0.19675897
'And I said to the priest, "Where is the god?" 	0.27574214	0.52749896	0.19675897
'And he answered me: "There is no god but this mirror that thou seest, for this is the Mirror of Wisdom.  	0.56479144	0.3808266	0.05438204
And it reflecteth all things that are in heaven and on earth, save only the face of him who looketh into it. 	0.27574214	0.52749896	0.19675897
This it reflecteth not, so that he who looketh into it may be wise. 	0.27574214	0.52749896	0.19675897
Many other mirrors are there, but they are mirrors of Opinion. 	0.27574214	0.52749896	0.19675897
This only is the Mirror of Wisdom. 	0.27574214	0.52749896	0.19675897
And they who possess this mirror know everything, nor is there anything hidden from them. 	0.27574214	0.52749896	0.19675897
And they who possess it not have not Wisdom. 	0.11110061	0.43357334	0.45532602
Therefore is it the god, and we worship it." 	0.56479144	0.3808266	0.05438204
And I looked into the mirror, and it was even as he had said to me. 	0.27574214	0.52749896	0.19675897
'And I did a strange thing, but what I did matters not, for in a valley that is but a day’s journey from this place have I hidden the Mirror of Wisdom. 	0.27574214	0.52749896	0.19675897
Do but suffer me to enter into thee again and be thy servant, and thou shalt be wiser than all the wise men, and Wisdom shall be thine. 	0.56479144	0.3808266	0.05438204
Suffer me to enter into thee, and none will be as wise as thou.' 	0.11110061	0.43357334	0.45532602
But the young Fisherman laughed. 	0.56479144	0.3808266	0.05438204
'Love is better than Wisdom,' he cried, 'and the little Mermaid loves me.' 	0.56479144	0.3808266	0.05438204
'Nay, but there is nothing better than Wisdom,' said the Soul. 	0.56479144	0.3808266	0.05438204
'Love is better,' answered the young Fisherman, and he plunged into the deep, and the Soul went weeping away over the marshes. 	0.56479144	0.3808266	0.05438204
And after the second year was over, the Soul came down to the shore of the sea, and called to the young Fisherman, and he rose out of the deep and said, 'Why dost thou call to me?' 	0.27574214	0.52749896	0.19675897
And the Soul answered, 'Come nearer, that I may speak with thee, for I have seen marvellous things.' 	0.56479144	0.3808266	0.05438204
So he came nearer, and couched in the shallow water, and leaned his head upon his hand and listened. 	0.27574214	0.52749896	0.19675897
And the Soul said to him, 'When I left thee, I turned my face to the South and journeyed. 	0.27574214	0.52749896	0.19675897
From the South cometh everything that is precious. 	0.56479144	0.3808266	0.05438204
Six days I journeyed along the highways that lead to the city of Ashter, along the dusty red–dyed highways by which the pilgrims are wont to go did I journey, and on the morning of the seventh day I lifted up my eyes, and lo! the city lay at my feet, for it is in a valley. 	0.27574214	0.52749896	0.19675897
'There are nine gates to this city, and in front of each gate stands a bronze horse that neighs when the Bedouins come down from the mountains. 	0.27574214	0.52749896	0.19675897
The walls are cased with copper, and the watch–towers on the walls are roofed with brass. 	0.27574214	0.52749896	0.19675897
In every tower stands an archer with a bow in his hand. 	0.27574214	0.52749896	0.19675897
At sunrise he strikes with an arrow on a gong, and at sunset he blows through a horn of horn. 	0.27574214	0.52749896	0.19675897
'When I sought to enter, the guards stopped me and asked of me who I was. 	0.11110061	0.43357334	0.45532602
I made answer that I was a Dervish and on my way to the city of Mecca, where there was a green veil on which the Koran was embroidered in silver letters by the hands of the angels. They were filled with wonder, and entreated me to pass in. 	0.27574214	0.52749896	0.19675897
'Inside it is even as a bazaar. 	0.27574214	0.52749896	0.19675897
Surely thou shouldst have been with me. 	0.27574214	0.52749896	0.19675897
Across the narrow streets the gay lanterns of paper flutter like large butterflies. 	0.27574214	0.52749896	0.19675897
When the wind blows over the roofs they rise and fall as painted bubbles do. 	0.27574214	0.52749896	0.19675897
In front of their booths sit the merchants on silken carpets. 	0.27574214	0.52749896	0.19675897
They have straight black beards, and their turbans are covered with golden sequins, and long strings of amber and carved peach–stones glide through their cool fingers. 	0.27574214	0.52749896	0.19675897
Some of them sell galbanum and nard, and curious perfumes from the islands of the Indian Sea, and the thick oil of red roses, and myrrh and little nail–shaped cloves. 	0.27574214	0.52749896	0.19675897
When one stops to speak to them, they throw pinches of frankincense upon a charcoal brazier and make the air sweet. 	0.27574214	0.52749896	0.19675897
I saw a Syrian who held in his hands a thin rod like a reed. 	0.27574214	0.52749896	0.19675897
Grey threads of smoke came from it, and its odour as it burned was as the odour of the pink almond in spring. 	0.27574214	0.52749896	0.19675897
Others sell silver bracelets embossed all over with creamy blue turquoise stones, and anklets of brass wire fringed with little pearls, and tigers' claws set in gold, and the claws of that gilt cat, the leopard, set in gold also, and earrings of pierced emerald, and finger–rings of hollowed jade. 	0.27574214	0.52749896	0.19675897
From the tea–houses comes the sound of the guitar, and the opium–smokers with their white smiling faces look out at the passers–by. 	0.27574214	0.52749896	0.19675897
'Of a truth thou shouldst have been with me. 	0.27574214	0.52749896	0.19675897
The wine–sellers elbow their way through the crowd with great black skins on their shoulders. 	0.27574214	0.52749896	0.19675897
Most of them sell the wine of Schiraz, which is as sweet as honey. 	0.27574214	0.52749896	0.19675897
They serve it in little metal cups and strew rose leaves upon it. 	0.27574214	0.52749896	0.19675897
In the market–place stand the fruitsellers, who sell all kinds of fruit: ripe figs, with their bruised purple flesh, melons, smelling of musk and yellow as topazes, citrons and rose–apples and clusters of white grapes, round red–gold oranges, and oval lemons of green gold. 	0.56479144	0.3808266	0.05438204
Once I saw an elephant go by. Its trunk was painted with vermilion and turmeric, and over its ears it had a net of crimson silk cord. 	0.27574214	0.52749896	0.19675897
It stopped opposite one of the booths and began eating the oranges, and the man only laughed. Thou canst not think how strange a people they are. 	0.11110061	0.43357334	0.45532602
When they are glad they go to the bird–sellers and buy of them a caged bird, and set it free that their joy may be greater, and when they are sad they scourge themselves with thorns that their sorrow may not grow less. 	0.56479144	0.3808266	0.05438204
'One evening I met some negroes carrying a heavy palanquin through the bazaar. 	0.27574214	0.52749896	0.19675897
It was made of gilded bamboo, and the poles were of vermilion lacquer studded with brass peacocks. 	0.27574214	0.52749896	0.19675897
Across the windows hung thin curtains of muslin embroidered with beetles' wings and with tiny seed–pearls, and as it passed by a pale–faced Circassian looked out and smiled at me. 	0.27574214	0.52749896	0.19675897
I followed behind, and the negroes hurried their steps and scowled. 	0.11110061	0.43357334	0.45532602
But I did not care. 	0.27574214	0.52749896	0.19675897
I felt a great curiosity come over me. 	0.56479144	0.3808266	0.05438204
'At last they stopped at a square white house. 	0.27574214	0.52749896	0.19675897
There were no windows to it, only a little door like the door of a tomb. 	0.27574214	0.52749896	0.19675897
They set down the palanquin and knocked three times with a copper hammer. 	0.11110061	0.43357334	0.45532602
An Armenian in a caftan of green leather peered through the wicket, and when he saw them he opened, and spread a carpet on the ground, and the woman stepped out. 	0.27574214	0.52749896	0.19675897
As she went in, she turned round and smiled at me again.  	0.56479144	0.3808266	0.05438204
I had never seen any one so pale. 	0.11110061	0.43357334	0.45532602
'When the moon rose I returned to the same place and sought for the house, but it was no longer there. 	0.27574214	0.52749896	0.19675897
When I saw that, I knew who the woman was, and wherefore she had smiled at me. 	0.56479144	0.3808266	0.05438204
'Certainly thou shouldst have been with me. 	0.27574214	0.52749896	0.19675897
On the feast of the New Moon the young Emperor came forth from his palace and went into the mosque to pray. 	0.27574214	0.52749896	0.19675897
His hair and beard were dyed with rose–leaves, and his cheeks were powdered with a fine gold dust. 	0.27574214	0.52749896	0.19675897
The palms of his feet and hands were yellow with saffron. 	0.27574214	0.52749896	0.19675897
'At sunrise he went forth from his palace in a robe of silver, and at sunset he returned to it again in a robe of gold. 	0.27574214	0.52749896	0.19675897
The people flung themselves on the ground and hid their faces, but I would not do so. 	0.11110061	0.43357334	0.45532602
I stood by the stall of a seller of dates and waited. 	0.27574214	0.52749896	0.19675897
When the Emperor saw me, he raised his painted eyebrows and stopped. 	0.27574214	0.52749896	0.19675897
I stood quite still, and made him no obeisance. 	0.27574214	0.52749896	0.19675897
The people marvelled at my boldness, and counselled me to flee from the city. 	0.56479144	0.3808266	0.05438204
I paid no heed to them, but went and sat with the sellers of strange gods, who by reason of their craft are abominated. 	0.11110061	0.43357334	0.45532602
When I told them what I had done, each of them gave me a god and prayed me to leave them. 	0.27574214	0.52749896	0.19675897
'That night, as I lay on a cushion in the tea–house that is in the Street of Pomegranates, the guards of the Emperor entered and led me to the palace. 	0.27574214	0.52749896	0.19675897
As I went in they closed each door behind me, and put a chain across it. 	0.27574214	0.52749896	0.19675897
Inside was a great court with an arcade running all round. 	0.56479144	0.3808266	0.05438204
The walls were of white alabaster, set here and there with blue and green tiles. 	0.27574214	0.52749896	0.19675897
The pillars were of green marble, and the pavement of a kind of peach–blossom marble. 	0.27574214	0.52749896	0.19675897
I had never seen anything like it before. 	0.11110061	0.43357334	0.45532602
'As I passed across the court two veiled women looked down from a balcony and cursed me. The guards hastened on, and the butts of the lances rang upon the polished floor. 	0.11110061	0.43357334	0.45532602
They opened a gate of wrought ivory, and I found myself in a watered garden of seven terraces. It was planted with tulip–cups and moonflowers, and silver–studded aloes. 	0.27574214	0.52749896	0.19675897
Like a slim reed of crystal a fountain hung in the dusky air. 	0.27574214	0.52749896	0.19675897
The cypress–trees were like burnt–out torches. 	0.11110061	0.43357334	0.45532602
From one of them a nightingale was singing. 	0.27574214	0.52749896	0.19675897
'At the end of the garden stood a little pavilion. 	0.27574214	0.52749896	0.19675897
As we approached it two eunuchs came out to meet us. 	0.27574214	0.52749896	0.19675897
Their fat bodies swayed as they walked, and they glanced curiously at me with their yellow–lidded eyes. 	0.27574214	0.52749896	0.19675897
One of them drew aside the captain of the guard, and in a low voice whispered to him. 	0.27574214	0.52749896	0.19675897
The other kept munching scented pastilles, which he took with an affected gesture out of an oval box of lilac enamel. 	0.27574214	0.52749896	0.19675897
'After a few moments the captain of the guard dismissed the soldiers. 	0.11110061	0.43357334	0.45532602
They went back to the palace, the eunuchs following slowly behind and plucking the sweet mulberries from the trees as they passed. 	0.27574214	0.52749896	0.19675897
Once the elder of the two turned round, and smiled at me with an evil smile. 	0.11110061	0.43357334	0.45532602
'Then the captain of the guard motioned me towards the entrance of the pavilion. 	0.27574214	0.52749896	0.19675897
I walked on without trembling, and drawing the heavy curtain aside I entered in. 	0.27574214	0.52749896	0.19675897
'The young Emperor was stretched on a couch of dyed lion skins, and a gerfalcon perched upon his wrist. 	0.27574214	0.52749896	0.19675897
Behind him stood a brass–turbaned Nubian, naked down to the waist, and with heavy earrings in his split ears. 	0.27574214	0.52749896	0.19675897
On a table by the side of the couch lay a mighty scimitar of steel. 	0.27574214	0.52749896	0.19675897
'When the Emperor saw me he frowned, and said to me, "What is thy name? 	0.27574214	0.52749896	0.19675897
Knowest thou not that I am Emperor of this city?" But I made him no answer. 	0.27574214	0.52749896	0.19675897
'He pointed with his finger at the scimitar, and the Nubian seized it, and rushing forward struck at me with great violence. 	0.27574214	0.52749896	0.19675897
The blade whizzed through me, and did me no hurt. 	0.56479144	0.3808266	0.05438204
The man fell sprawling on the floor, and when he rose up his teeth chattered with terror and he hid himself behind the couch. 	0.11110061	0.43357334	0.45532602
'The Emperor leapt to his feet, and taking a lance from a stand of arms, he threw it at me. 	0.27574214	0.52749896	0.19675897
I caught it in its flight, and brake the shaft into two pieces. 	0.27574214	0.52749896	0.19675897
He shot at me with an arrow, but I held up my hands and it stopped in mid–air. 	0.11110061	0.43357334	0.45532602
Then he drew a dagger from a belt of white leather, and stabbed the Nubian in the throat lest the slave should tell of his dishonour. 	0.11110061	0.43357334	0.45532602
The man writhed like a trampled snake, and a red foam bubbled from his lips. 	0.11110061	0.43357334	0.45532602
'As soon as he was dead the Emperor turned to me, and when he had wiped away the bright sweat from his brow with a little napkin of purfled and purple silk, he said to me, "Art thou a prophet, that I may not harm thee, or the son of a prophet, that I can do thee no hurt? 	0.11110061	0.43357334	0.45532602
I pray thee leave my city to–night, for while thou art in it I am no longer its lord." 	0.11110061	0.43357334	0.45532602
'And I answered him, "I will go for half of thy treasure. 	0.27574214	0.52749896	0.19675897
Give me half of thy treasure, and I will go away." 	0.11110061	0.43357334	0.45532602
'He took me by the hand, and led me out into the garden. 	0.27574214	0.52749896	0.19675897
When the captain of the guard saw me, he wondered. 	0.27574214	0.52749896	0.19675897
