sentence	positive	neutral	negative
She had been embalmed by a Moorish physician, who in return for this service had been granted his life, which for heresy and suspicion of magical practices had been already forfeited, men said, to the Holy Office, and her body was still lying on its tapestried bier in the black marble chapel of the Palace, just as the monks had borne her in on that windy March day nearly twelve years before. 	0.11110061	0.43357334	0.45532602
Once every month the King, wrapped in a dark cloak and with a muffled lantern in his hand, went in and knelt by her side calling out, 'Mi reina! Mi reina!' and sometimes breaking through the formal etiquette that in Spain governs every separate action of life, and sets limits even to the sorrow of a King, he would clutch at the pale jewelled hands in a wild agony of grief, and try to wake by his mad kisses the cold painted face. 	0.11110061	0.43357334	0.45532602
To–day he seemed to see her again, as he had seen her first at the Castle of Fontainebleau, when he was but fifteen years of age, and she still younger.  	0.27574214	0.52749896	0.19675897
They had been formally betrothed on that occasion by the Papal Nuncio in the presence of the French King and all the Court, and he had returned to the Escurial bearing with him a little ringlet of yellow hair, and the memory of two childish lips bending down to kiss his hand as he stepped into his carriage. 	0.27574214	0.52749896	0.19675897
Later on had followed the marriage, hastily performed at Burgos, a small town on the frontier between the two countries, and the grand public entry into Madrid with the customary celebration of high mass at the Church of La Atocha, and a more than usually solemn auto–da–fe, in which nearly three hundred heretics, amongst whom were many Englishmen, had been delivered over to the secular arm to be burned. 	0.11110061	0.43357334	0.45532602
Certainly he had loved her madly, and to the ruin, many thought, of his country, then at war with England for the possession of the empire of the New World.  	0.11110061	0.43357334	0.45532602
He had hardly ever permitted her to be out of his sight; for her, he had forgotten, or seemed to have forgotten, all grave affairs of State; and, with that terrible blindness that passion brings upon its servants, he had failed to notice that the elaborate ceremonies by which he sought to please her did but aggravate the strange malady from which she suffered.  	0.11110061	0.43357334	0.45532602
When she died he was, for a time, like one bereft of reason. Indeed, there is no doubt but that he would have formally abdicated and retired to the great Trappist monastery at Granada, of which he was already titular Prior, had he not been afraid to leave the little Infanta at the mercy of his brother, whose cruelty, even in Spain, was notorious, and who was suspected by many of having caused the Queen’s death by means of a pair of poisoned gloves that he had presented to her on the occasion of her visiting his castle in Aragon.  	0.11110061	0.43357334	0.45532602
Even after the expiration of the three years of public mourning that he had ordained throughout his whole dominions by royal edict, he would never suffer his ministers to speak about any new alliance, and when the Emperor himself sent to him, and offered him the hand of the lovely Archduchess of Bohemia, his niece, in marriage, he bade the ambassadors tell their master that the King of Spain was already wedded to Sorrow, and that though she was but a barren bride he loved her better than Beauty; an answer that cost his crown the rich provinces of the Netherlands, which soon after, at the Emperor’s instigation, revolted against him under the leadership of some fanatics of the Reformed Church. 	0.11110061	0.43357334	0.45532602
His whole married life, with its fierce, fiery–coloured joys and the terrible agony of its sudden ending, seemed to come back to him to–day as he watched the Infanta playing on the terrace. 	0.11110061	0.43357334	0.45532602
She had all the Queen’s pretty petulance of manner, the same wilful way of tossing her head, the same proud curved beautiful mouth, the same wonderful smile—vrai sourire de France indeed—as she glanced up now and then at the window, or stretched out her little hand for the stately Spanish gentlemen to kiss.  	0.56479144	0.3808266	0.05438204
But the shrill laughter of the children grated on his ears, and the bright pitiless sunlight mocked his sorrow, and a dull odour of strange spices, spices such as embalmers use, seemed to taint—or was it fancy?—the clear morning air.  	0.11110061	0.43357334	0.45532602
He buried his face in his hands, and when the Infanta looked up again the curtains had been drawn, and the King had retired. 	0.27574214	0.52749896	0.19675897
She made a little moue of disappointment, and shrugged her shoulders. Surely he might have stayed with her on her birthday. 	0.11110061	0.43357334	0.45532602
What did the stupid State–affairs matter? Or had he gone to that gloomy chapel, where the candles were always burning, and where she was never allowed to enter?  	0.11110061	0.43357334	0.45532602
How silly of him, when the sun was shining so brightly, and everybody was so happy!  	0.11110061	0.43357334	0.45532602
Besides, he would miss the sham bull–fight for which the trumpet was already sounding, to say 	0.11110061	0.43357334	0.45532602
nothing of the puppet–show and the other wonderful things.  	0.56479144	0.3808266	0.05438204
Her uncle and the Grand Inquisitor were much more sensible.  	0.11110061	0.43357334	0.45532602
They had come out on the terrace, and paid her nice compliments.  	0.56479144	0.3808266	0.05438204
So she tossed her pretty head, and taking Don Pedro by the hand, she walked slowly down the steps towards a long pavilion of purple silk that had been erected at the end of the garden, the other children following in strict order of precedence, those who had the longest names going first. 	0.27574214	0.52749896	0.19675897
A procession of noble boys, fantastically dressed as toreadors, came out to meet her, and the young Count of Tierra–Nueva, a wonderfully handsome lad of about fourteen years of age, uncovering his head with all the grace of a born hidalgo and grandee of Spain, led her solemnly in to a little gilt and ivory chair that was placed on a raised dais above the arena.  	0.56479144	0.3808266	0.05438204
The children grouped themselves all round, fluttering their big fans and whispering to each other, and Don Pedro and the Grand Inquisitor stood laughing at the entrance. 	0.56479144	0.3808266	0.05438204
Even the Duchess—the Camerera–Mayor as she was called—a thin, hard–featured woman with a yellow ruff, did not look quite so bad–tempered as usual, and something like a chill smile flitted across her wrinkled face and twitched her thin bloodless lips. 	0.11110061	0.43357334	0.45532602
It certainly was a marvellous bull–fight, and much nicer, the Infanta thought, than the real bull–fight that she had been brought to see at Seville, on the occasion of the visit of the Duke of Parma to her father. 	0.56479144	0.3808266	0.05438204
Some of the boys pranced about on richly–caparisoned hobby–horses brandishing long javelins with gay streamers of bright ribands attached to them; others went on foot waving their scarlet cloaks before the bull, and vaulting lightly over the barrier when he charged them; and as for the bull himself, he was just like a live bull, though he was only made of wicker–work and stretched hide, and sometimes insisted on running round the arena on his hind legs, which no live bull ever dreams of doing. 	0.11110061	0.43357334	0.45532602
He made a splendid fight of it too, and the children got so excited that they stood up upon the benches, and waved their lace handkerchiefs and cried out: Bravo toro! Bravo toro! just as sensibly as if they had been grown–up people. 	0.56479144	0.3808266	0.05438204
At last, however, after a prolonged combat, during which several of the hobby–horses were gored through and through, and, their riders dismounted, the young Count of Tierra–Nueva brought the bull to his knees, and having obtained permission from the Infanta to give the coup de grace, he plunged his wooden sword into the neck of the animal with such violence that the head came right off, and disclosed the laughing face of little Monsieur de Lorraine, the son of the French Ambassador at Madrid. 	0.11110061	0.43357334	0.45532602
The arena was then cleared amidst much applause, and the dead hobbyhorses dragged solemnly away by two Moorish pages in yellow and black liveries, and after a short interlude, during which a French posture–master performed upon the tightrope, some Italian puppets appeared in the semi–classical tragedy of Sophonisba on the stage of a small theatre that had been built up for the purpose. 	0.11110061	0.43357334	0.45532602
They acted so well, and their gestures were so extremely natural, that at the close of the play the eyes of the Infanta were quite dim with tears. Indeed some of the children really cried, and had to be comforted with sweetmeats, and the Grand Inquisitor himself was so affected that he could not help saying to Don Pedro that it seemed to him intolerable that things made simply out of wood and coloured wax, and worked mechanically by wires, should be so unhappy and meet with such terrible misfortunes. 	0.11110061	0.43357334	0.45532602
An African juggler followed, who brought in a large flat basket covered with a red cloth, and having placed it in the centre of the arena, he took from his turban a curious reed pipe, and blew through it. 	0.27574214	0.52749896	0.19675897
In a few moments the cloth began to move, and as the pipe grew shriller and shriller two green and gold snakes put out their strange wedge–shaped heads and rose slowly up, swaying to and fro with the music as a plant sways in the water. 	0.27574214	0.52749896	0.19675897
The children, however, were rather frightened at their spotted hoods and quick darting tongues, and were much more pleased when the juggler made a tiny orange–tree grow out of the sand and bear pretty white blossoms and clusters of real fruit; and when he took the fan of the little daughter of the Marquess de Las–Torres, and changed it into a blue bird that flew all round the pavilion and sang, their delight and amazement knew no bounds. 	0.11110061	0.43357334	0.45532602
The solemn minuet, too, performed by the dancing boys from the church of Nuestra Senora Del Pilar, was charming.  	0.56479144	0.3808266	0.05438204
The Infanta had never before seen this wonderful ceremony which takes place every year at Maytime in front of the high altar of the Virgin, and in her honour; and indeed none of the royal family of Spain had entered the great cathedral of Saragossa since a mad priest, supposed by many to have been in the pay of Elizabeth of England, had tried to administer a poisoned wafer to the Prince of the Asturias. 	0.11110061	0.43357334	0.45532602
So she had known only by hearsay of 'Our Lady’s Dance,' as it was called, and it certainly was a beautiful sight. 	0.56479144	0.3808266	0.05438204
The boys wore old–fashioned court dresses of white velvet, and their curious three–cornered hats were fringed with silver and surmounted with huge plumes of ostrich feathers, the dazzling whiteness of their costumes, as they moved about in the sunlight, being still more accentuated by their swarthy faces and long black hair. 	0.27574214	0.52749896	0.19675897
Everybody was fascinated by the grave dignity with which they moved through the intricate figures of the dance, and by the elaborate grace of their slow gestures, and stately bows, and when they had finished their performance and doffed their great plumed hats to the Infanta, she acknowledged their reverence with much courtesy, and made a vow that she would send a large wax candle to the shrine of Our Lady of Pilar in return for the pleasure that she had given her. 	0.56479144	0.3808266	0.05438204
A troop of handsome Egyptians—as the gipsies were termed in those days—then advanced into the arena, and sitting down cross–legs, in a circle, began to play softly upon their zithers, moving their bodies to the tune, and humming, almost below their breath, a low dreamy air. 	0.56479144	0.3808266	0.05438204
When they caught sight of Don Pedro they scowled at him, and some of them looked terrified, for only a few weeks before he had had two of their tribe hanged for sorcery in the market– place at Seville, but the pretty Infanta charmed them as she leaned back peeping over her fan with her great blue eyes, and they felt sure that one so lovely as she was could never be cruel to anybody.  	0.11110061	0.43357334	0.45532602
So they played on very gently and just touching the cords of the zithers with their long pointed nails, and their heads began to nod as though they were falling asleep.  	0.27574214	0.52749896	0.19675897
Suddenly, with a cry so shrill that all the children were startled and Don Pedro’s hand clutched at the agate pommel of his dagger, they leapt to their feet and whirled madly round the enclosure beating their tambourines, and chaunting some wild love–song in their strange guttural language.  	0.11110061	0.43357334	0.45532602
Then at another signal they all flung themselves again to the ground and lay there quite still, the dull strumming of the zithers being the only sound that broke the silence.  	0.11110061	0.43357334	0.45532602
After that they had done this several times, they disappeared for a moment and came back leading a brown shaggy bear by a chain, and carrying on their shoulders some little Barbary apes.  	0.11110061	0.43357334	0.45532602
The bear stood upon his head with the utmost gravity, and the wizened apes played all kinds of amusing tricks with two gipsy boys who seemed to be their masters, and fought with tiny swords, and fired off guns, and went through a regular soldier’s drill just like the King’s own bodyguard.  	0.27574214	0.52749896	0.19675897
In fact the gipsies were a great success. 	0.56479144	0.3808266	0.05438204
But the funniest part of the whole morning’s entertainment, was undoubtedly the dancing of the little Dwarf.  	0.56479144	0.3808266	0.05438204
When he stumbled into the arena, waddling on his crooked legs and wagging his huge misshapen head from side to side, the children went off into a loud shout of delight, and the Infanta herself laughed so much that the Camerera was obliged to remind her that although there were many precedents in Spain for a King’s daughter weeping before her equals, there were none for a Princess of the blood royal making so merry before those who were her inferiors in birth.  	0.11110061	0.43357334	0.45532602
The Dwarf, however, was really quite irresistible, and even at the Spanish Court, always noted for its cultivated passion for the horrible, so fantastic a little monster had never been seen.  	0.56479144	0.3808266	0.05438204
It was his first appearance, too.  	0.27574214	0.52749896	0.19675897
He had been discovered only the day before, running wild through the forest, by two of the nobles who happened to have been hunting in a remote part of the great cork–wood that surrounded the town, and had been carried off by them to the Palace as a surprise for the Infanta; his father, who was a poor charcoal–burner, being but too well pleased to get rid of so ugly and 	0.11110061	0.43357334	0.45532602
useless a child.  	0.11110061	0.43357334	0.45532602
Perhaps the most amusing thing about him was his complete unconsciousness of his own grotesque appearance. 	0.11110061	0.43357334	0.45532602
Indeed he seemed quite happy and full of the highest spirits. 	0.56479144	0.3808266	0.05438204
When the children laughed, he laughed as freely and as joyously as any of them, and at the close of each dance he made them each the funniest of bows, smiling and nodding at them just as if he was really one of themselves, and not a little misshapen thing that Nature, in some humourous mood, had fashioned for others to mock at. 	0.11110061	0.43357334	0.45532602
As for the Infanta, she absolutely fascinated him. 	0.56479144	0.3808266	0.05438204
He could not keep his eyes off her, and seemed to dance for her alone, and when at the close of the performance, remembering how she had seen the great ladies of the Court throw bouquets to Caffarelli, the famous Italian treble, whom the Pope had sent from his own chapel to Madrid 	0.27574214	0.52749896	0.19675897
that he might cure the King’s melancholy by the sweetness of his voice, she took out of her hair the beautiful white rose, and partly for a jest and partly to tease the Camerera, threw it to him across the arena with her sweetest smile, he took the whole matter quite seriously, and pressing the flower to his rough coarse lips he put his hand upon his heart, and sank on one knee before her, grinning from ear to ear, and with his little bright eyes sparkling with pleasure. 	0.56479144	0.3808266	0.05438204
This so upset the gravity of the Infanta that she kept on laughing long after the little Dwarf had ran out of the arena, and expressed a desire to her uncle that the dance should be immediately repeated. 	0.11110061	0.43357334	0.45532602
The Camerera, however, on the plea that the sun was too hot, decided that it would be better that her Highness should return without delay to the Palace, where a wonderful feast had been already prepared for her, including a real birthday cake with her own initials worked all over it in painted sugar and a lovely silver flag waving from the top. 	0.56479144	0.3808266	0.05438204
The Infanta accordingly rose up with much dignity, and having given orders that the little dwarf was to dance again for her after the hour of siesta, and conveyed her thanks to the young Count of Tierra–Nueva for his charming reception, she went back to her apartments, the children following in the same order in which they had entered. 	0.56479144	0.3808266	0.05438204
Now when the little Dwarf heard that he was to dance a second time before the Infanta, and by her own express command, he was so proud that he ran out into the garden, kissing the white rose in an absurd ecstasy of pleasure, and making the most uncouth and clumsy gestures of delight. 	0.56479144	0.3808266	0.05438204
The Flowers were quite indignant at his daring to intrude into their beautiful home, and when they saw him capering up and down the walks, and waving his arms above his head in such a ridiculous manner, they could not restrain their feelings any longer.  	0.11110061	0.43357334	0.45532602
'He is really far too ugly to be allowed to play in any place where we are,' cried the Tulips.  	0.11110061	0.43357334	0.45532602
'He should drink poppy–juice, and go to sleep for a thousand years,' said the great scarlet Lilies, and they grew quite hot and angry.  	0.11110061	0.43357334	0.45532602
'He is a perfect horror!' screamed the Cactus.  	0.11110061	0.43357334	0.45532602
'Why, he is twisted and stumpy, and his head is completely out of proportion with his legs. Really he makes me feel prickly all over, and if he comes near me I will sting him with my thorns.'  	0.11110061	0.43357334	0.45532602
'And he has actually got one of my best blooms,' exclaimed the White Rose–Tree.  	0.56479144	0.3808266	0.05438204
'I gave it to the Infanta this morning myself, as a birthday present, and he has stolen it from her.' And she called out: 'Thief, thief, thief!' at the top of her voice. 	0.11110061	0.43357334	0.45532602
Even the red Geraniums, who did not usually give themselves airs, and were known to have a great many poor relations themselves, curled up in disgust when they saw him, and when the Violets meekly remarked that though he was certainly extremely plain, still he could not help it, they retorted with a good deal of justice that that was his chief defect, and that there was no reason why one should admire a person because he was incurable; and, indeed, some of the 	0.11110061	0.43357334	0.45532602
Violets themselves felt that the ugliness of the little Dwarf was almost ostentatious, and that he would have shown much better taste if he had looked sad, or at least pensive, instead of jumping about merrily, and throwing himself into such grotesque and silly attitudes. 	0.11110061	0.43357334	0.45532602
As for the old Sundial, who was an extremely remarkable individual, and had once told the time of day to no less a person than the Emperor Charles V. himself, he was so taken aback by the little Dwarf’s appearance, that he almost forgot to mark two whole minutes with his long shadowy finger, and could not help saying to the great milk–white Peacock, who was sunning herself on the balustrade, that every one knew that the children of Kings were Kings, and that the children of charcoal–burners were charcoal–burners, and that it was absurd to pretend that it wasn’t so; a statement with which the Peacock entirely agreed, and indeed screamed out, 'Certainly, certainly,' in such a loud, harsh voice, that the gold–fish who lived in the basin of the cool splashing fountain put their heads out of the water, and asked the huge stone Tritons what on earth was the matter. 	0.11110061	0.43357334	0.45532602
But somehow the Birds liked him.  	0.56479144	0.3808266	0.05438204
They had seen him often in the forest, dancing about like an elf after the eddying leaves, or crouched up in the hollow of some old oak–tree, sharing his nuts with the squirrels.  	0.27574214	0.52749896	0.19675897
They did not mind his being ugly, a bit. Why, even the nightingale herself, who sang so sweetly in the orange groves at night that sometimes the Moon leaned down to listen, was not much to look at after all; and, besides, he had been kind to them, and during that terribly bitter winter, when there were no berries on the trees, and the ground was as hard as iron, and the wolves had come down to the very gates of the city to look for food, he had never once forgotten them, but had always given them crumbs out of his little hunch of black bread, and divided with them whatever poor breakfast he had. 	0.11110061	0.43357334	0.45532602
So they flew round and round him, just touching his cheek with their wings as they passed, and chattered to each other, and the little Dwarf was so pleased that he could not help showing them the beautiful white rose, and telling them that the Infanta herself had given it to him because she loved him. 	0.27574214	0.52749896	0.19675897
They did not understand a single word of what he was saying, but that made no matter, for they put their heads on one side, and looked wise, which is quite as good as understanding a thing, and very much easier. 	0.56479144	0.3808266	0.05438204
The Lizards also took an immense fancy to him, and when he grew tired of running about and flung himself down on the grass to rest, they played and romped all over him, and tried to amuse him in the best way they could. 'Every one cannot be as beautiful as a lizard,' they cried; 'that would be too much to expect. And, though it sounds absurd to say so, he is really not so ugly after all, provided, of course, that one shuts one’s eyes, and does not look at him.' The 	0.11110061	0.43357334	0.45532602
Lizards were extremely philosophical by nature, and often sat thinking for hours and hours together, when there was nothing else to do, or when the weather was too rainy for them to go out. 	0.27574214	0.52749896	0.19675897
The Flowers, however, were excessively annoyed at their behaviour, and at the behaviour of the birds.  	0.11110061	0.43357334	0.45532602
'It only shows,' they said, 'what a vulgarising effect this incessant rushing and flying about has. 	0.11110061	0.43357334	0.45532602
Well–bred people always stay exactly in the same place, as we do.  	0.27574214	0.52749896	0.19675897
No one ever saw us hopping up and down the walks, or galloping madly through the grass after dragon–flies.  	0.11110061	0.43357334	0.45532602
When we do want change of air, we send for the gardener, and he carries us to another bed. 	0.27574214	0.52749896	0.19675897
This is dignified, and as it should be. 	0.56479144	0.3808266	0.05438204
But birds and lizards have no sense of repose, and indeed birds have not even a permanent address. 	0.11110061	0.43357334	0.45532602
They are mere vagrants like the gipsies, and should be treated in exactly the same manner.' 	0.11110061	0.43357334	0.45532602
So they put their noses in the air, and looked very haughty, and were quite delighted when after some time they saw the little Dwarf scramble up from the grass, and make his way across the terrace to the palace. 	0.56479144	0.3808266	0.05438204
'He should certainly be kept indoors for the rest of his natural life,' they said. 	0.27574214	0.52749896	0.19675897
'Look at his hunched back, and his crooked legs,' and they began to titter. 	0.11110061	0.43357334	0.45532602
But the little Dwarf knew nothing of all this. 	0.27574214	0.52749896	0.19675897
He liked the birds and the lizards immensely, and thought that the flowers were the most marvellous things in the whole world, except of course the Infanta, but then she had given him the beautiful white rose, and she loved him, and that made a great difference. 	0.56479144	0.3808266	0.05438204
How he wished that he had gone back with her! 	0.11110061	0.43357334	0.45532602
She would have put him on her right hand, and smiled at him, and he would have never left her side, but would have made her his playmate, and taught her all kinds of delightful tricks. 	0.56479144	0.3808266	0.05438204
For though he had never been in a palace before, he knew a great many wonderful things. 	0.56479144	0.3808266	0.05438204
